2024,3,ZW,Air Wisconsin Airlines Corp,RST,"Rochester, MN: Rochester International",22.00,0.00,0.00,0.00,0.00,0.00,0.00,0.00,0.00,0.00,0.00,0.00,0.00,0.00,0.00
2024,3,ZW,Air Wisconsin Airlines Corp,SCE,"State College, PA: University Park",31.00,3.00,1.00,0.00,2.00,0.00,0.00,0.00,0.00,70.00,32.00,0.00,38.00,0.00,0.00
2024,3,ZW,Air Wisconsin Airlines Corp,SDF,"Louisville, KY: Louisville Muhammad Ali International",11.00,1.00,0.00,0.00,1.00,0.00,0.00,0.00,0.00,18.00,0.00,0.00,18.00,0.00,0.00
2024,3,ZW,Air Wisconsin Airlines Corp,SGF,"Springfield, MO: Springfield-Branson National",32.00,6.00,3.71,0.00,0.30,0.00,1.99,0.00,0.00,649.00,388.00,0.00,53.00,0.00,208.00
2024,3,ZW,Air Wisconsin Airlines Corp,SPI,"Springfield, IL: Abraham Lincoln Capital",58.00,9.00,3.00,0.24,2.35,0.00,3.41,0.00,0.00,443.00,157.00,25.00,90.00,0.00,171.00
2024,3,ZW,Air Wisconsin Airlines Corp,TVC,"Traverse City, MI: Cherry Capital",57.00,11.00,3.93,0.51,3.35,1.00,2.21,0.00,0.00,740.00,215.00,49.00,97.00,31.00,348.00
2024,3,ZW,Air Wisconsin Airlines Corp,TYS,"Knoxville, TN: McGhee Tyson",28.00,2.00,0.09,0.00,1.46,0.00,0.46,0.00,0.00,54.00,3.00,0.00,35.00,0.00,16.00
2024,3,AA,American Airlines Network,DFW,"Dallas/Fort Worth, TX: Dallas/Fort Worth International",14026.00,3651.00,833.72,199.53,988.46,14.36,1614.92,237.00,81.00,361570.00,101714.00,24485.00,49334.00,672.00,185365.00
2024,3,AA,American Airlines Network,DSM,"Des Moines, IA: Des Moines International",232.00,70.00,25.59,3.54,6.95,0.24,33.68,0.00,0.00,4940.00,2046.00,395.00,328.00,23.00,2148.00
2024,3,AA,American Airlines Network,DTW,"Detroit, MI: Detroit Metro Wayne County",487.00,129.00,43.51,5.27,11.65,0.42,68.14,6.00,1.00,8462.00,2851.00,300.00,525.00,11.00,4775.00
2024,3,AA,American Airlines Network,ECP,"Panama City, FL: Northwest Florida Beaches International",122.00,35.00,9.52,0.34,6.61,0.00,18.54,1.00,0.00,3653.00,1206.00,34.00,387.00,0.00,2026.00
2024,3,AA,American Airlines Network,EGE,"Eagle, CO: Eagle County Regional",253.00,64.00,26.19,2.19,14.42,0.00,21.20,2.00,2.00,7352.00,2106.00,203.00,751.00,0.00,4292.00
2024,3,AA,American Airlines Network,ELP,"El Paso, TX: El Paso International",239.00,75.00,19.27,4.11,8.26,0.00,43.36,2.00,1.00,5350.00,1015.00,490.00,376.00,0.00,3469.00
2024,3,AA,American Airlines Network,EUG,"Eugene, OR: Mahlon Sweet Field",62.00,23.00,4.97,0.31,1.84,0.00,15.88,1.00,0.00,2214.00,449.00,34.00,92.00,0.00,1639.00
2024,3,AA,American Airlines Network,EWR,"Newark, NJ: Newark Liberty International",542.00,197.00,55.39,3.19,54.65,2.68,81.09,11.00,0.00,13062.00,3381.00,422.00,2386.00,68.00,6805.00
2024,3,AA,American Airlines Network,EYW,"Key West, FL: Key West International",213.00,85.00,14.84,3.59,38.39,0.00,28.19,7.00,0.00,10134.00,1812.00,1387.00,2669.00,0.00,4266.00
2024,3,AA,American Airlines Network,FAT,"Fresno, CA: Fresno Yosemite International",207.00,59.00,16.96,1.84,7.61,0.00,32.59,1.00,0.00,4141.00,1152.00,95.00,215.00,0.00,2679.00
2024,3,AA,American Airlines Network,FLL,"Fort Lauderdale, FL: Fort Lauderdale-Hollywood International",682.00,228.00,44.42,6.40,87.16,0.80,89.21,8.00,4.00,17105.00,3222.00,810.00,5073.00,20.00,7980.00
2024,3,AA,American Airlines Network,FSD,"Sioux Falls, SD: Joe Foss Field",62.00,15.00,1.97,0.62,1.28,0.00,11.14,1.00,0.00,1122.00,99.00,15.00,77.00,0.00,931.00
2024,3,AA,American Airlines Network,GEG,"Spokane, WA: Spokane International",121.00,43.00,16.78,0.43,6.06,0.00,19.73,0.00,1.00,5855.00,2012.00,125.00,215.00,0.00,3503.00
2024,3,AA,American Airlines Network,GRR,"Grand Rapids, MI: Gerald R. Ford International",242.00,72.00,24.51,1.80,5.96,0.06,39.68,2.00,0.00,6364.00,1293.00,145.00,271.00,6.00,4649.00
2024,3,AA,American Airlines Network,GSO,"Greensboro/High Point, NC: Piedmont Triad International",96.00,37.00,14.19,1.58,4.59,0.00,16.63,3.00,0.00,4102.00,2052.00,204.00,251.00,0.00,1595.00
2024,3,AA,American Airlines Network,GSP,"Greer, SC: Greenville-Spartanburg International",62.00,25.00,10.16,0.81,2.02,0.00,12.01,3.00,0.00,2006.00,595.00,50.00,111.00,0.00,1250.00
2024,3,AA,American Airlines Network,GUC,"Gunnison, CO: Gunnison-Crested Butte Regional",31.00,8.00,2.65,0.05,0.00,0.00,5.30,0.00,0.00,712.00,161.00,10.00,0.00,0.00,541.00
2024,3,AA,American Airlines Network,HDN,"Hayden, CO: Yampa Valley",54.00,9.00,2.13,0.26,1.65,0.00,4.97,0.00,2.00,523.00,56.00,13.00,59.00,0.00,395.00
2024,3,AA,American Airlines Network,HNL,"Honolulu, HI: Daniel K Inouye International",215.00,27.00,14.39,0.00,6.95,0.00,5.67,0.00,0.00,1513.00,1009.00,0.00,198.00,0.00,306.00
2024,3,AA,American Airlines Network,IAD,"Washington, DC: Washington Dulles International",60.00,30.00,9.25,0.72,5.52,0.00,14.51,0.00,0.00,1743.00,358.00,80.00,238.00,0.00,1067.00
2024,3,AA,American Airlines Network,IAH,"Houston, TX: George Bush Intercontinental/Houston",512.00,153.00,50.42,6.74,29.56,0.04,66.24,9.00,2.00,12056.00,3747.00,537.00,1600.00,8.00,6164.00
2024,3,AA,American Airlines Network,ICT,"Wichita, KS: Wichita Dwight D Eisenhower National",62.00,28.00,6.65,1.59,1.27,1.00,17.50,0.00,0.00,2383.00,846.00,128.00,77.00,31.00,1301.00
2024,3,AA,American Airlines Network,ILM,"Wilmington, NC: Wilmington International",112.00,32.00,12.34,1.00,3.14,0.82,14.70,1.00,1.00,2434.00,1038.00,34.00,137.00,45.00,1180.00
2024,3,AA,American Airlines Network,IND,"Indianapolis, IN: Indianapolis International",501.00,167.00,52.03,1.44,28.95,1.13,83.44,3.00,0.00,11532.00,3208.00,82.00,1092.00,38.00,7112.00
2024,3,AA,American Airlines Network,JAC,"Jackson, WY: Jackson Hole",93.00,20.00,4.93,0.00,5.00,0.00,10.07,0.00,5.00,1544.00,225.00,0.00,171.00,0.00,1148.00
2024,3,AA,American Airlines Network,JAX,"Jacksonville, FL: Jacksonville International",674.00,215.00,61.07,5.58,41.68,1.31,105.35,7.00,0.00,16410.00,4103.00,537.00,1858.00,36.00,9876.00
2024,3,AA,American Airlines Network,JFK,"New York, NY: John F. Kennedy International",1274.00,334.00,95.37,13.69,123.51,2.09,99.34,9.00,5.00,31305.00,9754.00,1313.00,6551.00,63.00,13624.00
2024,3,AA,American Airlines Network,KOA,"Kona, HI: Ellison Onizuka Kona International at Keahole",62.00,9.00,1.23,0.00,4.97,0.00,2.80,0.00,0.00,479.00,56.00,0.00,178.00,0.00,245.00
2024,3,AA,American Airlines Network,LAS,"Las Vegas, NV: Harry Reid International",1158.00,365.00,86.72,20.72,99.87,2.23,155.46,10.00,7.00,28044.00,5740.00,2571.00,5568.00,68.00,14097.00
2024,3,AA,American Airlines Network,LAX,"Los Angeles, CA: Los Angeles International",2540.00,575.00,170.51,20.72,185.14,2.35,196.28,6.00,1.00,50820.00,17592.00,1950.00,7667.00,105.00,23506.00
2024,3,AA,American Airlines Network,LBB,"Lubbock, TX: Lubbock Preston Smith International",36.00,18.00,7.59,1.11,1.52,0.00,7.78,0.00,0.00,4791.00,1848.00,65.00,61.00,0.00,2817.00
2024,3,AA,American Airlines Network,LEX,"Lexington, KY: Blue Grass",62.00,22.00,10.48,0.00,5.12,0.00,6.40,4.00,0.00,1251.00,568.00,0.00,223.00,0.00,460.00
2024,3,AA,American Airlines Network,LGA,"New York, NY: LaGuardia",1555.00,453.00,130.31,12.61,107.46,1.02,201.60,19.00,8.00,33637.00,10039.00,1023.00,4764.00,75.00,17736.00
2024,3,AA,American Airlines Network,LIH,"Lihue, HI: Lihue Airport",62.00,9.00,1.46,0.00,1.19,0.00,6.35,0.00,0.00,536.00,113.00,0.00,22.00,0.00,401.00
2024,3,AA,American Airlines Network,LIT,"Little Rock, AR: Bill and Hillary Clinton Nat Adams Field",26.00,5.00,2.53,0.00,1.17,0.00,1.30,0.00,0.00,506.00,140.00,0.00,29.00,0.00,337.00
2024,3,AA,American Airlines Network,MCI,"Kansas City, MO: Kansas City International",456.00,138.00,42.18,3.75,24.78,0.08,67.21,5.00,2.00,8244.00,2194.00,364.00,997.00,19.00,4670.00
2024,3,AA,American Airlines Network,MCO,"Orlando, FL: Orlando International",1627.00,524.00,131.12,15.22,156.07,2.93,218.66,12.00,1.00,41259.00,9882.00,1563.00,10012.00,193.00,19609.00
2024,3,AA,American Airlines Network,MDT,"Harrisburg, PA: Harrisburg International",57.00,18.00,7.18,1.57,2.59,0.00,6.66,0.00,0.00,929.00,327.00,127.00,75.00,0.00,400.00
2024,3,AA,American Airlines Network,MEM,"Memphis, TN: Memphis International",339.00,116.00,33.29,2.58,18.43,0.79,60.91,5.00,3.00,6870.00,1830.00,143.00,689.00,32.00,4176.00
2024,3,AA,American Airlines Network,MFE,"Mission/McAllen/Edinburg, TX: McAllen International",141.00,45.00,10.90,3.49,7.28,0.13,23.21,2.00,0.00,3060.00,974.00,203.00,254.00,2.00,1627.00
2024,3,AA,American Airlines Network,MIA,"Miami, FL: Miami International",5235.00,1393.00,346.13,39.05,568.46,4.34,435.03,151.00,33.00,143080.00,47952.00,6856.00,30714.00,189.00,57369.00
2024,3,AA,American Airlines Network,MKE,"Milwaukee, WI: General Mitchell International",217.00,80.00,33.74,3.21,6.53,1.00,35.53,3.00,1.00,6281.00,1950.00,556.00,323.00,430.00,3022.00
2024,3,AA,American Airlines Network,MRY,"Monterey, CA: Monterey Regional",62.00,14.00,5.22,0.40,0.50,0.00,7.88,1.00,0.00,958.00,302.00,64.00,16.00,0.00,576.00
2024,3,AA,American Airlines Network,MSN,"Madison, WI: Dane County Regional-Truax Field",186.00,77.00,25.89,3.94,9.87,0.48,36.82,1.00,2.00,5870.00,1739.00,292.00,420.00,15.00,3404.00
2024,3,AA,American Airlines Network,MSP,"Minneapolis, MN: Minneapolis-St Paul International",337.00,101.00,33.47,5.36,12.94,0.55,48.68,3.00,0.00,6343.00,1664.00,671.00,517.00,11.00,3480.00
2024,3,AA,American Airlines Network,MSY,"New Orleans, LA: Louis Armstrong New Orleans International",605.00,210.00,58.97,8.97,48.33,0.00,93.74,6.00,1.00,14006.00,3327.00,1179.00,2084.00,0.00,7416.00
2024,3,AA,American Airlines Network,MTJ,"Montrose/Delta, CO: Montrose Regional",54.00,8.00,3.09,0.16,0.88,0.00,3.87,0.00,0.00,1564.00,141.00,102.00,42.00,0.00,1279.00
2024,3,AA,American Airlines Network,MYR,"Myrtle Beach, SC: Myrtle Beach International",67.00,22.00,6.91,0.97,1.83,0.00,12.29,0.00,0.00,1633.00,563.00,35.00,47.00,0.00,988.00
2024,3,AA,American Airlines Network,OGG,"Kahului, HI: Kahului Airport",124.00,13.00,6.56,0.00,2.26,0.00,4.18,0.00,0.00,685.00,477.00,0.00,82.00,0.00,126.00
2024,3,AA,American Airlines Network,OKC,"Oklahoma City, OK: Will Rogers World",217.00,75.00,23.25,3.56,8.56,0.00,39.63,6.00,0.00,5420.00,2004.00,356.00,353.00,0.00,2707.00
2024,3,AA,American Airlines Network,OMA,"Omaha, NE: Eppley Airfield",276.00,84.00,28.74,4.41,11.25,0.69,38.91,2.00,0.00,6161.00,2163.00,814.00,560.00,11.00,2613.00
2024,3,AA,American Airlines Network,ONT,"Ontario, CA: Ontario International",300.00,81.00,23.40,2.19,9.41,0.00,46.00,1.00,0.00,6270.00,1565.00,371.00,306.00,0.00,4028.00
2024,3,AA,American Airlines Network,ORD,"Chicago, IL: Chicago O'Hare International",3917.00,887.00,243.70,20.58,210.55,2.81,409.36,21.00,8.00,94991.00,36876.00,3264.00,8508.00,97.00,46246.00
2024,3,AA,American Airlines Network,ORF,"Norfolk, VA: Norfolk International",247.00,67.00,21.78,3.09,9.17,0.00,32.96,3.00,0.00,4249.00,1377.00,142.00,409.00,0.00,2321.00
2024,3,AA,American Airlines Network,PBI,"West Palm Beach/Palm Beach, FL: Palm Beach International",589.00,193.00,31.28,3.15,75.31,0.29,82.98,5.00,1.00,14266.00,1975.00,628.00,3956.00,21.00,7686.00
2024,3,AA,American Airlines Network,PDX,"Portland, OR: Portland International",266.00,82.00,28.67,3.70,14.25,0.64,34.74,2.00,0.00,4404.00,1330.00,274.00,619.00,49.00,2132.00
2024,3,AA,American Airlines Network,PHL,"Philadelphia, PA: Philadelphia International",2896.00,755.00,245.91,15.15,182.88,5.34,305.73,14.00,6.00,60182.00,19086.00,2164.00,7404.00,179.00,31349.00
2024,3,DL,Delta Air Lines Network,SEA,"Seattle, WA: Seattle/Tacoma International",2471.00,318.00,122.19,3.09,79.58,0.00,113.14,2.00,5.00,23647.00,11145.00,224.00,3497.00,0.00,8781.00
2024,3,DL,Delta Air Lines Network,SFO,"San Francisco, CA: San Francisco International",998.00,358.00,63.23,2.96,260.97,0.00,30.84,1.00,3.00,19927.00,5432.00,234.00,12274.00,0.00,1987.00
2024,3,DL,Delta Air Lines Network,SGF,"Springfield, MO: Springfield-Branson National",23.00,4.00,1.33,0.00,1.00,0.00,1.67,0.00,0.00,178.00,98.00,0.00,18.00,0.00,62.00
2024,3,DL,Delta Air Lines Network,SJC,"San Jose, CA: Norman Y. Mineta San Jose International",171.00,21.00,8.23,0.41,7.13,0.00,5.23,0.00,1.00,966.00,517.00,11.00,231.00,0.00,207.00
2024,3,DL,Delta Air Lines Network,SJU,"San Juan, PR: Luis Munoz Marin International",356.00,51.00,20.29,0.08,22.88,0.00,7.76,0.00,0.00,2201.00,1023.00,4.00,788.00,0.00,386.00
2024,3,DL,Delta Air Lines Network,SLC,"Salt Lake City, UT: Salt Lake City International",4476.00,549.00,172.82,14.37,123.98,0.00,237.83,3.00,5.00,37795.00,14868.00,2014.00,4009.00,0.00,16904.00
2024,3,DL,Delta Air Lines Network,SMF,"Sacramento, CA: Sacramento International",238.00,28.00,15.61,0.25,9.13,0.00,3.01,0.00,0.00,2091.00,1577.00,23.00,403.00,0.00,88.00
2024,3,DL,Delta Air Lines Network,SNA,"Santa Ana, CA: John Wayne Airport-Orange County",381.00,56.00,28.41,0.06,16.54,0.00,11.00,1.00,0.00,2634.00,1657.00,6.00,447.00,0.00,524.00
2024,3,DL,Delta Air Lines Network,SRQ,"Sarasota/Bradenton, FL: Sarasota/Bradenton International",309.00,67.00,23.66,0.00,28.32,0.00,15.02,0.00,0.00,5135.00,1675.00,0.00,2229.00,0.00,1231.00
2024,3,DL,Delta Air Lines Network,STL,"St. Louis, MO: St Louis Lambert International",453.00,56.00,30.67,0.28,17.78,0.00,7.26,1.00,1.00,2862.00,1893.00,41.00,617.00,0.00,311.00
2024,3,DL,Delta Air Lines Network,STT,"Charlotte Amalie, VI: Cyril E King",98.00,15.00,6.58,0.00,7.54,0.00,0.89,0.00,0.00,718.00,445.00,0.00,257.00,0.00,16.00
2024,3,DL,Delta Air Lines Network,STX,"Christiansted, VI: Henry E. Rohlsen",29.00,5.00,1.60,0.00,3.40,0.00,0.00,0.00,0.00,240.00,101.00,0.00,139.00,0.00,0.00
2024,3,DL,Delta Air Lines Network,SYR,"Syracuse, NY: Syracuse Hancock International",119.00,21.00,13.63,0.00,1.30,0.00,6.08,0.00,0.00,737.00,484.00,0.00,38.00,0.00,215.00
2024,3,DL,Delta Air Lines Network,TLH,"Tallahassee, FL: Tallahassee International",147.00,24.00,14.60,0.24,5.61,0.00,3.56,0.00,1.00,1025.00,701.00,4.00,165.00,0.00,155.00
2024,3,DL,Delta Air Lines Network,TPA,"Tampa, FL: Tampa International",1151.00,318.00,109.39,2.35,130.89,0.00,75.38,1.00,3.00,22470.00,8271.00,188.00,9010.00,0.00,5001.00
2024,3,DL,Delta Air Lines Network,TUL,"Tulsa, OK: Tulsa International",115.00,15.00,8.33,0.00,2.95,0.00,3.71,0.00,0.00,648.00,268.00,0.00,155.00,0.00,225.00
2024,3,DL,Delta Air Lines Network,TUS,"Tucson, AZ: Tucson International",150.00,24.00,11.62,0.30,9.68,0.00,2.40,0.00,0.00,1150.00,725.00,27.00,318.00,0.00,80.00
2024,3,DL,Delta Air Lines Network,TVC,"Traverse City, MI: Cherry Capital",31.00,7.00,4.52,0.00,1.48,0.00,1.00,0.00,0.00,288.00,191.00,0.00,36.00,0.00,61.00
2024,3,DL,Delta Air Lines Network,TYS,"Knoxville, TN: McGhee Tyson",110.00,24.00,15.52,0.00,2.16,0.00,6.32,0.00,0.00,1314.00,1016.00,0.00,72.00,0.00,226.00
2024,3,DL,Delta Air Lines Network,VPS,"Valparaiso, FL: Eglin AFB Destin Fort Walton Beach",217.00,35.00,19.21,2.99,9.88,0.00,2.92,1.00,2.00,2233.00,1027.00,715.00,353.00,0.00,138.00
2024,3,DL,Delta Air Lines Network,XNA,"Fayetteville, AR: Northwest Arkansas National",55.00,7.00,5.73,0.00,0.11,0.00,1.17,0.00,0.00,249.00,209.00,0.00,4.00,0.00,36.00
2024,3,F9,Frontier Airlines,ATL,"Atlanta, GA: Hartsfield-Jackson Atlanta International",858.00,251.00,60.60,1.99,55.21,0.00,133.19,23.00,0.00,22445.00,6090.00,1068.00,2662.00,0.00,12625.00
2024,3,F9,Frontier Airlines,AUS,"Austin, TX: Austin - Bergstrom International",38.00,10.00,1.29,0.10,3.78,0.00,4.84,1.00,0.00,447.00,57.00,4.00,95.00,0.00,291.00
2024,3,F9,Frontier Airlines,BDL,"Hartford, CT: Bradley International",85.00,36.00,7.46,0.69,14.04,0.00,13.81,3.00,1.00,1893.00,476.00,51.00,580.00,0.00,786.00
2024,3,F9,Frontier Airlines,BNA,"Nashville, TN: Nashville International",58.00,8.00,0.00,0.00,1.00,0.00,7.00,2.00,0.00,552.00,0.00,0.00,19.00,0.00,533.00
2024,3,F9,Frontier Airlines,BOS,"Boston, MA: Logan International",75.00,11.00,6.98,0.00,1.02,0.00,3.00,2.00,0.00,1918.00,384.00,0.00,16.00,0.00,1518.00
2024,3,F9,Frontier Airlines,BQN,"Aguadilla, PR: Rafael Hernandez",59.00,17.00,3.26,0.00,0.69,0.00,13.05,0.00,0.00,1044.00,174.00,0.00,27.00,0.00,843.00
2024,3,F9,Frontier Airlines,BUF,"Buffalo, NY: Buffalo Niagara International",108.00,32.00,10.08,0.00,5.26,0.00,16.66,3.00,1.00,3109.00,777.00,0.00,212.00,0.00,2120.00
2024,3,F9,Frontier Airlines,BWI,"Baltimore, MD: Baltimore/Washington International Thurgood Marshall",201.00,59.00,17.59,0.00,11.46,0.00,29.94,6.00,1.00,4881.00,882.00,0.00,835.00,0.00,3164.00
2024,3,F9,Frontier Airlines,CHS,"Charleston, SC: Charleston AFB/International",10.00,2.00,0.00,0.00,1.00,0.00,1.00,0.00,0.00,47.00,0.00,0.00,28.00,0.00,19.00
2024,3,F9,Frontier Airlines,CID,"Cedar Rapids/Iowa City, IA: The Eastern Iowa",26.00,7.00,0.09,0.54,1.32,0.00,5.05,0.00,0.00,655.00,18.00,45.00,160.00,0.00,432.00
2024,3,F9,Frontier Airlines,CLE,"Cleveland, OH: Cleveland-Hopkins International",533.00,186.00,45.94,0.29,50.56,0.00,89.21,10.00,0.00,18071.00,5450.00,47.00,3004.00,0.00,9570.00
2024,3,F9,Frontier Airlines,CLT,"Charlotte, NC: Charlotte Douglas International",167.00,53.00,15.61,0.54,6.52,0.00,30.33,2.00,0.00,3995.00,1117.00,63.00,350.00,0.00,2465.00
2024,3,F9,Frontier Airlines,CMH,"Columbus, OH: John Glenn Columbus International",13.00,7.00,1.87,0.00,2.96,0.00,2.17,0.00,0.00,808.00,561.00,0.00,141.00,0.00,106.00
2024,3,F9,Frontier Airlines,CVG,"Cincinnati, OH: Cincinnati/Northern Kentucky International",463.00,132.00,30.39,2.81,25.59,0.00,73.21,14.00,0.00,11672.00,3044.00,109.00,989.00,0.00,7530.00
2024,3,F9,Frontier Airlines,DCA,"Washington, DC: Ronald Reagan Washington National",93.00,16.00,4.22,0.56,1.93,0.00,9.29,3.00,0.00,719.00,113.00,14.00,75.00,0.00,517.00
2024,3,F9,Frontier Airlines,DEN,"Denver, CO: Denver International",1944.00,526.00,100.21,5.85,94.89,0.00,325.05,86.00,0.00,48834.00,10894.00,1700.00,4461.00,0.00,31779.00
2024,3,F9,Frontier Airlines,DFW,"Dallas/Fort Worth, TX: Dallas/Fort Worth International",782.00,275.00,66.91,3.16,68.99,0.00,135.94,27.00,3.00,24723.00,5750.00,179.00,4228.00,0.00,14566.00
2024,3,F9,Frontier Airlines,DSM,"Des Moines, IA: Des Moines International",30.00,13.00,2.23,0.00,6.63,0.00,4.14,0.00,0.00,942.00,183.00,0.00,278.00,0.00,481.00
2024,3,F9,Frontier Airlines,DTW,"Detroit, MI: Detroit Metro Wayne County",227.00,70.00,23.04,0.00,21.33,0.00,25.62,4.00,0.00,4698.00,1691.00,0.00,909.00,0.00,2098.00
2024,3,F9,Frontier Airlines,ELP,"El Paso, TX: El Paso International",44.00,7.00,3.12,0.00,0.50,0.00,3.38,1.00,0.00,470.00,125.00,0.00,29.00,0.00,316.00
2024,3,F9,Frontier Airlines,FAR,"Fargo, ND: Hector International",35.00,4.00,1.32,0.00,1.19,0.00,1.49,1.00,0.00,331.00,64.00,0.00,38.00,0.00,229.00
2024,3,F9,Frontier Airlines,FLL,"Fort Lauderdale, FL: Fort Lauderdale-Hollywood International",191.00,65.00,12.30,0.00,26.58,0.00,26.12,5.00,1.00,5744.00,1388.00,0.00,2200.00,0.00,2156.00
2024,3,F9,Frontier Airlines,FSD,"Sioux Falls, SD: Joe Foss Field",19.00,3.00,0.40,0.00,0.00,0.00,2.60,0.00,0.00,167.00,19.00,0.00,0.00,0.00,148.00
2024,3,F9,Frontier Airlines,GRB,"Green Bay, WI: Green Bay Austin Straubel International",28.00,6.00,0.00,0.33,2.78,0.00,2.89,0.00,0.00,261.00,0.00,24.00,106.00,0.00,131.00
2024,3,F9,Frontier Airlines,GRR,"Grand Rapids, MI: Gerald R. Ford International",114.00,28.00,6.45,0.57,6.55,0.00,14.43,2.00,0.00,2363.00,275.00,43.00,401.00,0.00,1644.00
2024,3,F9,Frontier Airlines,HOU,"Houston, TX: William P Hobby",34.00,5.00,1.02,0.00,2.37,0.00,1.61,2.00,0.00,365.00,133.00,0.00,109.00,0.00,123.00
2024,3,F9,Frontier Airlines,IAD,"Washington, DC: Washington Dulles International",,,,,,,,,,,,,,,
2024,3,F9,Frontier Airlines,IAH,"Houston, TX: George Bush Intercontinental/Houston",168.00,46.00,10.21,0.44,14.67,0.00,20.68,2.00,0.00,3454.00,835.00,27.00,774.00,0.00,1818.00
2024,3,F9,Frontier Airlines,IND,"Indianapolis, IN: Indianapolis International",45.00,10.00,5.88,0.78,0.28,0.00,3.06,2.00,0.00,1713.00,992.00,49.00,22.00,0.00,650.00
2024,3,F9,Frontier Airlines,ISP,"Islip, NY: Long Island MacArthur",191.00,45.00,11.89,0.00,6.38,0.00,26.74,5.00,2.00,3728.00,857.00,0.00,532.00,0.00,2339.00
2024,3,F9,Frontier Airlines,JAX,"Jacksonville, FL: Jacksonville International",102.00,27.00,6.76,0.47,6.93,0.00,12.85,4.00,0.00,1595.00,391.00,34.00,230.00,0.00,940.00
2024,3,F9,Frontier Airlines,LAS,"Las Vegas, NV: Harry Reid International",1110.00,418.00,70.31,4.13,96.61,0.00,246.95,19.00,3.00,39779.00,7495.00,1512.00,7486.00,0.00,23286.00
2024,3,F9,Frontier Airlines,LGA,"New York, NY: LaGuardia",126.00,52.00,14.87,1.08,14.61,0.00,21.44,2.00,0.00,4093.00,1113.00,174.00,865.00,0.00,1941.00
2024,3,F9,Frontier Airlines,LIT,"Little Rock, AR: Bill and Hillary Clinton Nat Adams Field",7.00,4.00,0.30,0.00,0.73,0.00,2.97,0.00,0.00,260.00,34.00,0.00,11.00,0.00,215.00
2024,3,F9,Frontier Airlines,MCI,"Kansas City, MO: Kansas City International",56.00,9.00,1.77,0.00,0.64,0.00,6.58,1.00,0.00,628.00,148.00,0.00,17.00,0.00,463.00
2024,3,F9,Frontier Airlines,MCO,"Orlando, FL: Orlando International",1964.00,634.00,117.44,4.81,158.53,0.00,353.23,56.00,4.00,79042.00,19167.00,1523.00,14013.00,0.00,44339.00
2024,3,F9,Frontier Airlines,MDT,"Harrisburg, PA: Harrisburg International",15.00,6.00,1.31,0.95,2.29,0.00,1.44,0.00,0.00,852.00,54.00,55.00,168.00,0.00,575.00
2024,3,F9,Frontier Airlines,MDW,"Chicago, IL: Chicago Midway International",362.00,95.00,30.96,0.58,18.78,0.00,44.68,5.00,1.00,7635.00,2458.00,61.00,1311.00,0.00,3805.00
2024,3,F9,Frontier Airlines,MEM,"Memphis, TN: Memphis International",22.00,2.00,0.00,0.00,0.20,0.00,1.80,1.00,0.00,96.00,0.00,0.00,16.00,0.00,80.00
2024,3,F9,Frontier Airlines,MIA,"Miami, FL: Miami International",394.00,147.00,29.62,0.91,46.28,0.00,70.18,7.00,0.00,17754.00,3181.00,85.00,5203.00,0.00,9285.00
2024,3,F9,Frontier Airlines,MKE,"Milwaukee, WI: General Mitchell International",75.00,14.00,5.60,0.00,2.41,0.00,5.99,1.00,1.00,1341.00,540.00,0.00,188.00,0.00,613.00
2024,3,F9,Frontier Airlines,MSN,"Madison, WI: Dane County Regional-Truax Field",33.00,9.00,0.57,0.35,3.39,0.00,4.68,2.00,0.00,888.00,53.00,11.00,155.00,0.00,669.00
2024,3,F9,Frontier Airlines,MSP,"Minneapolis, MN: Minneapolis-St Paul International",185.00,59.00,17.18,0.00,15.12,0.00,26.70,10.00,0.00,3543.00,863.00,0.00,729.00,0.00,1951.00
2024,3,F9,Frontier Airlines,MSY,"New Orleans, LA: Louis Armstrong New Orleans International",85.00,25.00,4.46,0.00,4.96,0.00,15.58,3.00,1.00,1360.00,355.00,0.00,109.00,0.00,896.00
2024,3,F9,Frontier Airlines,MYR,"Myrtle Beach, SC: Myrtle Beach International",2.00,1.00,0.16,0.00,0.84,0.00,0.00,0.00,0.00,32.00,5.00,0.00,27.00,0.00,0.00
2024,3,F9,Frontier Airlines,OKC,"Oklahoma City, OK: Will Rogers World",44.00,4.00,0.41,0.00,1.86,0.00,1.73,1.00,0.00,140.00,18.00,0.00,41.00,0.00,81.00
2024,3,F9,Frontier Airlines,OMA,"Omaha, NE: Eppley Airfield",45.00,15.00,4.25,0.66,3.23,0.00,6.86,1.00,0.00,1031.00,211.00,65.00,237.00,0.00,518.00
2024,3,F9,Frontier Airlines,ONT,"Ontario, CA: Ontario International",256.00,59.00,14.31,1.59,11.62,0.00,31.48,2.00,0.00,3787.00,670.00,54.00,361.00,0.00,2702.00
2024,3,F9,Frontier Airlines,ORD,"Chicago, IL: Chicago O'Hare International",107.00,48.00,10.51,0.00,6.89,0.00,30.60,1.00,0.00,4275.00,1169.00,0.00,327.00,0.00,2779.00
2024,3,F9,Frontier Airlines,ORF,"Norfolk, VA: Norfolk International",4.00,2.00,0.11,0.00,0.99,0.00,0.90,0.00,0.00,182.00,9.00,0.00,97.00,0.00,76.00
2024,3,F9,Frontier Airlines,PBI,"West Palm Beach/Palm Beach, FL: Palm Beach International",119.00,39.00,9.11,0.00,15.82,0.00,14.07,3.00,0.00,2741.00,690.00,0.00,844.00,0.00,1207.00
2024,3,F9,Frontier Airlines,PDX,"Portland, OR: Portland International",96.00,28.00,6.80,1.05,4.77,0.00,15.37,3.00,0.00,2860.00,1033.00,103.00,222.00,0.00,1502.00
2024,3,F9,Frontier Airlines,PHL,"Philadelphia, PA: Philadelphia International",1029.00,302.00,74.81,3.30,46.76,0.00,177.13,28.00,1.00,24888.00,8291.00,210.00,2271.00,0.00,14116.00
2024,3,F9,Frontier Airlines,PHX,"Phoenix, AZ: Phoenix Sky Harbor International",988.00,249.00,56.99,3.48,43.49,0.00,145.04,16.00,1.00,23038.00,7880.00,612.00,1708.00,0.00,12838.00
2024,3,F9,Frontier Airlines,PIT,"Pittsburgh, PA: Pittsburgh International",5.00,2.00,0.00,0.00,1.00,0.00,1.00,0.00,0.00,86.00,0.00,0.00,17.00,0.00,69.00
2024,3,F9,Frontier Airlines,PNS,"Pensacola, FL: Pensacola International",30.00,8.00,2.71,0.00,1.92,0.00,3.37,1.00,0.00,267.00,107.00,0.00,46.00,0.00,114.00
2024,3,F9,Frontier Airlines,PSE,"Ponce, PR: Mercedita",51.00,8.00,2.01,0.00,3.07,0.00,2.92,0.00,0.00,698.00,155.00,0.00,324.00,0.00,219.00
2024,3,F9,Frontier Airlines,PWM,"Portland, ME: Portland International Jetport",40.00,10.00,4.06,0.00,2.63,0.00,3.31,2.00,0.00,1389.00,458.00,0.00,187.00,0.00,744.00
2024,3,F9,Frontier Airlines,RDU,"Raleigh/Durham, NC: Raleigh-Durham International",191.00,53.00,19.50,0.00,5.55,0.00,27.96,4.00,0.00,7315.00,2868.00,0.00,397.00,0.00,4050.00
2024,3,F9,Frontier Airlines,RSW,"Fort Myers, FL: Southwest Florida International",439.00,163.00,22.94,3.27,76.98,0.00,59.81,17.00,0.00,13203.00,1591.00,176.00,5462.00,0.00,5974.00
2024,3,F9,Frontier Airlines,SAN,"San Diego, CA: San Diego International",242.00,61.00,13.82,1.30,20.84,0.00,25.04,3.00,0.00,3839.00,767.00,215.00,874.00,0.00,1983.00
2024,3,F9,Frontier Airlines,SAT,"San Antonio, TX: San Antonio International",44.00,17.00,1.60,1.00,2.27,0.00,12.12,1.00,0.00,1284.00,133.00,62.00,78.00,0.00,1011.00
2024,3,F9,Frontier Airlines,SAV,"Savannah, GA: Savannah/Hilton Head International",5.00,1.00,0.00,0.00,0.00,0.00,1.00,0.00,0.00,86.00,0.00,0.00,0.00,0.00,86.00
2024,3,F9,Frontier Airlines,SEA,"Seattle, WA: Seattle/Tacoma International",90.00,28.00,4.08,0.00,6.01,0.00,17.91,3.00,0.00,1785.00,271.00,0.00,233.00,0.00,1281.00
2024,3,F9,Frontier Airlines,SFO,"San Francisco, CA: San Francisco International",274.00,163.00,13.95,1.58,106.13,0.00,41.34,7.00,1.00,11136.00,1075.00,112.00,6636.00,0.00,3313.00
2024,3,F9,Frontier Airlines,SJU,"San Juan, PR: Luis Munoz Marin International",421.00,131.00,38.76,0.83,37.81,0.00,53.60,9.00,3.00,10126.00,4419.00,75.00,2218.00,0.00,3414.00
